<?xml version="1.0"?>
<ismrmrdHeader xmlns="http://www.ismrm.org/ISMRMRD" xmlns:xsi="http://www.w3.org/2001/XMLSchema-instance" xmlns:xs="http://www.w3.org/2001/XMLSchema" xsi:schemaLocation="http://www.ismrm.org/ISMRMRD ismrmrd.xsd">
  <subjectInformation>
    <patientName>Anonymous Patient</patientName>
    <patientWeight_kg>70.3068</patientWeight_kg>
    <patientID>BHHG8866789</patientID>
    <patientBirthdate>1980-06-12</patientBirthdate>
    <patientGender>M</patientGender>
  </subjectInformation>
  <studyInformation>
    <studyDate>2012-08-13</studyDate>
    <studyTime>09:00:00</studyTime>
    <studyID>NNLLJHG88997</studyID>
    <accessionNumber>7638376482</accessionNumber>
    <referringPhysicianName>John Doe, MD</referringPhysicianName>
    <studyDescription>This is an example study with all headers set</studyDescription>
  </studyInformation>
  <measurementInformation>
    <measurementID>LLJGHH888986</measurementID>
    <seriesDate>2012-08-13</seriesDate>
    <seriesTime>09:10:12</seriesTime>
    <patientPosition>HFS</patientPosition>
    <initialSeriesNumber>1</initialSeriesNumber>
    <protocolName>ExampleProt</protocolName>
    <seriesDescription>MRIStudy1</seriesDescription>
    <measurementDependency>
      <dependencyType>Noise</dependencyType>
      <measurementID>HHJJHJL000977889</measurementID>
    </measurementDependency>
    <measurementDependency>
      <dependencyType>SurfaceCoilCorrection</dependencyType>
      <measurementID>HHJJHJL000977810</measurementID>
    </measurementDependency>
  </measurementInformation>
  <acquisitionSystemInformation>
    <systemVendor>SIEMENS</systemVendor>
    <systemModel>Avanto</systemModel>
    <systemFieldStrength_T>1.494</systemFieldStrength_T>
    <relativeReceiverNoiseBandwidth>0.79</relativeReceiverNoiseBandwidth>
    <receiverChannels>32</receiverChannels>
    <institutionName>Some University</institutionName>
    <stationName>MRI Scanner 1</stationName>
  </acquisitionSystemInformation>
  <experimentalConditions>
    <H1resonanceFrequency_Hz>63642459</H1resonanceFrequency_Hz>
  </experimentalConditions>
  <encoding>
    <encodedSpace>
      <matrixSize>
        <x>256</x>
        <y>140</y>
        <z>80</z>
      </matrixSize>
      <fieldOfView_mm>
        <x>600</x>
        <y>328.153125</y>
        <z>160</z>
      </fieldOfView_mm>
    </encodedSpace>
    <reconSpace>
      <matrixSize>
        <x>128</x>
        <y>116</y>
        <z>64</z>
      </matrixSize>
      <fieldOfView_mm>
        <x>300</x>
        <y>271.875</y>
        <z>128</z>
      </fieldOfView_mm>
    </reconSpace>
    <encodingLimits>
      <kspace_encoding_step_1>
        <minimum>0</minimum>
        <maximum>83</maximum>
        <center>28</center>
      </kspace_encoding_step_1>
      <kspace_encoding_step_2>
        <minimum>0</minimum>
        <maximum>45</maximum>
        <center>20</center>
      </kspace_encoding_step_2>
      <slice>
        <minimum>0</minimum>
        <maximum>0</maximum>
        <center>0</center>
      </slice>
      <set>
        <minimum>0</minimum>
        <maximum>0</maximum>
        <center>0</center>
      </set>
    </encodingLimits>
    <trajectory>cartesian</trajectory>
  </encoding>
  <encoding>
    <encodedSpace>
      <matrixSize>
        <x>64</x>
        <y>64</y>
        <z>64</z>
      </matrixSize>
      <fieldOfView_mm>
        <x>300</x>
        <y>300</y>
        <z>300</z>
      </fieldOfView_mm>
    </encodedSpace>
    <reconSpace>
      <matrixSize>
        <x>64</x>
        <y>64</y>
        <z>64</z>
      </matrixSize>
      <fieldOfView_mm>
        <x>300</x>
        <y>300</y>
        <z>300</z>
      </fieldOfView_mm>
    </reconSpace>
    <encodingLimits>
      <kspace_encoding_step_1>
        <minimum>0</minimum>
        <maximum>8</maximum>
        <center>0</center>
      </kspace_encoding_step_1>
      <kspace_encoding_step_2>
        <minimum>0</minimum>
        <maximum>16</maximum>
        <center>0</center>
      </kspace_encoding_step_2>
      <average>
        <minimum>0</minimum>
        <maximum>16</maximum>
        <center>0</center>	
      </average>
      <slice>
        <minimum>0</minimum>
        <maximum>0</maximum>
        <center>0</center>
      </slice>
      <contrast>
        <minimum>2</minimum>
        <maximum>4</maximum>
        <center>3</center>	
      </contrast>
      <phase>
        <minimum>0</minimum>
        <maximum>0</maximum>
        <center>0</center>	
      </phase>
      <repetition>
	<minimum>0</minimum>
        <maximum>16</maximum>
        <center>8</center>	
      </repetition>
      <set>
        <minimum>0</minimum>
        <maximum>0</maximum>
        <center>0</center>
      </set>
      <segment>
        <minimum>0</minimum>
        <maximum>1</maximum>
        <center>0</center>	
      </segment>
    </encodingLimits>
    <trajectory>other</trajectory>
    <trajectoryDescription>
      <identifier>Custom Trajector</identifier>
      <userParameterLong>
	<name>sample_rate_ns</name>
	<value>100</value>
      </userParameterLong>
      <userParameterLong>
	<name>constant_1</name>
	<value>300</value>
      </userParameterLong>
      <userParameterDouble>
	<name>coefficient_1</name>
	<value>2.72386</value>
      </userParameterDouble>
      <userParameterDouble>
	<name>coefficient_2</name>
	<value>2233.72</value>
      </userParameterDouble>
      <userParameterDouble>
	<name>coefficient_3</name>
	<value>112.86</value>
      </userParameterDouble>
      <comment>This is an example description of a custom trajectory</comment>
    </trajectoryDescription>
  </encoding>
  <parallelImaging>
    <accelerationFactor>
      <kspace_encoding_step_1>1</kspace_encoding_step_1>
      <kspace_encoding_step_2>2</kspace_encoding_step_2>
    </accelerationFactor>
    <calibrationMode>other</calibrationMode>
  </parallelImaging>
  <sequenceParameters>
    <TR>4.6</TR>
    <TE>2.35</TE>
    <TE>4.35</TE>
    <TE>6.55</TE>
    <TE>9.22</TE>
    <TI>300.08</TI>
  </sequenceParameters>
  <dicomParameters>
    <studyInstanceUID>1.34.896.2789852.787873.9999</studyInstanceUID>
    <seriesInstanceUIDRoot>1.34.896.2789852.787873</seriesInstanceUIDRoot>
    <frameOfReferenceUID>1.34.896.2789852.787873.98788.78787</frameOfReferenceUID>
    <referencedImageSequence>
      <referencedSOPInstanceUID>1.34.896.2789852.787873.98788.78787.1</referencedSOPInstanceUID>
      <referencedSOPInstanceUID>1.34.896.2789852.787873.98788.78787.2</referencedSOPInstanceUID>
      <referencedSOPInstanceUID>1.34.896.2789852.787873.98788.78787.3</referencedSOPInstanceUID>
      <referencedSOPInstanceUID>1.34.896.2789852.787873.98788.78787.4</referencedSOPInstanceUID>
    </referencedImageSequence>
    <MRImageModule>
      <imageType>MAGNITUDE</imageType>
      <scanningSequence>TSE</scanningSequence>
      <sequenceVariant>HASTE</sequenceVariant>
      <scanOptions>Pre-ON</scanOptions>
      <mrAcquisitionType>SE</mrAcquisitionType>
      <echoTrainLength>12</echoTrainLength>
      <triggerTime>100.212</triggerTime>
      <flipAngle_deg>90.0</flipAngle_deg>
      <freqEncodingDirection>ROW</freqEncodingDirection>
    </MRImageModule>
  </dicomParameters>
  <userParameters>
    <userParameterLong>
      <name>dev_long_1</name>
      <value>789</value>
    </userParameterLong>
    <userParameterLong>
      <name>dev_long_2</name>
      <value>999</value>
    </userParameterLong>
    <userParameterDouble>
      <name>dev_double1</name>
      <value>999.999</value>
    </userParameterDouble>
    <userParameterDouble>
      <name>dev_double2</name>
      <value>9.1111</value>
    </userParameterDouble>
    <userParameterString>
      <name>FILTER_SHAPE</name>
      <value>GAUSSIAN</value>
    </userParameterString>
    <userParameterBase64>
      <name>VENDOR_PROTOCOL</name>
      <value>VGhpcyBpcyBhIGpvdXJuZXkgaW50byBzb3VuZA==</value>
    </userParameterBase64>
  </userParameters>
</ismrmrdHeader>

